song,lyrics
love," Damn, love or lust Damn, all of us   Give me a run for my money There is nobody, no one to outrun me (Another world premiere!) So give me a run for my money Sippin bubbly, feelin lovely, livin lovely Just love me I wanna be with you, ayy, I wanna be with I wanna be with you, ayy, I wanna be with I wanna be with you   If I didnt ride blade on curb, would you still love me? If I minimize my net worth, would you still love me? Keep it a hundred, Id rather you trust me than to love me Keep it a whole one hund: dont got you, I got nothin   Ayy, I got somethin Hol up, we gon function, no assumptions Feelin like Tyson with it Knock it out twice, Im with it Only for the night, Im kiddin Only for life, youre a homie for life Youre a homie for life, lets get it Hit that shoulder lean I know what comin over mean Backstroke oversea I know what you need Already on ten, our money come in All feeling go out, this feeling dont drought This party wont end   If I didnt ride blade on curb, would you still love me? If I minimize my net worth, would you still love me? Keep it a hundred, Id rather you trust me than to love me Keep it a whole one hund: dont got you, I got nothin   Give me a run for my money There is nobody, no one to outrun me So give me a run for my money Sippin bubbly, feelin lovely, livin lovely Just love me I wanna be with you, ayy, I wanna be with I wanna be with you, ayy, I wanna be with I wanna be with you   Im on the way We aint got no time to waste Poppin your gum on the way Am I in the way? I dont wan pressure you none I want your blessing today Oh, by the way, open the door by the way Told you that Im on the way Im on the way, I know connection is vague Pick up the phone for me, babe Damn it, we jammin Bad attitude from yo nanny Curves and your hips from yo mammy Remember Gardena, I took the studio camry I know Top will be mad at me I had to do it, I want your body, your music I bought the big one to prove it Look what you made Told you that Im on the way Im like an exit away, yep   If I didnt ride blade on curb, would you still love me? If I minimize my net worth, would you still love me? Keep it a hundred, Id rather you trust me than to love me Keep it a whole one hund: dont got you, I got nothin   Give me a run for my money There is nobody, no one to outrun me So give me a run for my money Sippin bubbly, feelin lovely, livin lovely Just love me I wanna be with you, ayy, I wanna be with I wanna be with you, ayy, I wanna be with I wanna be with you"
xxx," America, God bless you if its good to you America please take my hand Can you help me underst— New Kung Fu Kenny   Throw a steak off the ark To a pool full of sharks, hell take it Leave him in the wilderness With a sworn nemesis, hell make it Take the gratitude from him I bet hell show you somethin, whoa Ill chip a nigga little bit of nothin Ill chip a nigga little bit of nothin Ill chip a nigga little bit of nothin Ill chip a nigga, then throw the blower in his lap Walk myself to the court like, ""Bitch, I did that!"" X-rated  Johnny dont wanna go to school no mo, no mo Johnny said books aint cool no mo (no mo) Johnny wanna be a rapper like his big cousin Johnny caught a body yesterday out hustlin God bless America, you know we all love him  Yesterday I got a call like from my dog like 101 Said they killed his only son because of insufficient funds He was sobbin, he was mobbin, way belligerent and drunk Talkin out his head, philosphin on what the Lord had done He said: ""K-Dot, can you pray for me? Its been a fucked up day for me I know that you anointed, show me how to overcome."" He was lookin for some closure Hopin I could bring him closer To the spiritual, my spirit do no better, but I told him ""I cant sugarcoat the answer for you, this is how I feel: If somebody kill my son, that mean somebody gettin killed."" Tell me what you do for love, loyalty, and passion of All the memories collected, moments you could never touch  Ill wait in front a niggas spot and watch him hit his block Ill catch a nigga leavin service if thats all I got Ill chip a nigga, then throw the blower in his lap Walk myself to the court like, ""Bitch, I did that!"" Aint no Black Power when your baby killed by a coward I cant even keep the peace, dont you fuck with one of ours It be murder in the street, it be bodies in the hour Ghetto bird be on the street, paramedics on the dial Let somebody touch my mama Touch my sister, touch my woman Touch my daddy, touch my niece Touch my nephew, touch my brother  You should chip a nigga, then throw the blower in his lap Matter fact, Im bout to speak at this convention Call you back—   Alright, kids, were gonna talk about gun control (Pray for me) Damn!   Its not a place This country is to be a sound of drum and bass You close your eyes to look around   Hail Mary, Jesus and Joseph The great American flag Is wrapped and dragged with explosives Compulsive disorder, sons and daughters Barricaded blocks and borders Look what you taught us! Its murder on my street, your street, back streets Wall Street, corporate offices Banks, employees, and bosses with Homicidal thoughts; Donald Trumps in office We lost Barack and promised to never doubt him again But is America honest, or do we bask in sin? Pass the gin, I mix it with American blood Then bash him in, you Crippin or you married to blood? Ill ask again—oops—accident Its nasty when you set us up Then roll the dice, then bet us up You overnight the big rifles, then tell Fox to be scared of us Gang members or terrorists, et cetera, et cetera Americas reflections of me, thats what a mirror does   Its not a place This country is to be a sound of drum and bass You close your eyes to look ar—"
fear," I dont think I could find a way to make it on this earth Whats up, family? Yeah, its yo cousin Carl, man, just givin you a call, man. I know you been havin a lot on yo mind lately, and I know you feel like, you know, people aint been prayin for you. But you have to understand this, man, that we are a cursed people. Deuteronomy 28:28 says, ""The Lord shall smite thee with madness, and blindness, and astonishment of heart."" See, family, thats why you feel like you feel like you got a chip on your shoulder. Until you finally get the memo, you will always feel that way…   Why God, why God do I gotta suffer? Pain in my heart carry burdens full of struggle Why God, why God do I gotta bleed? Every stone thrown at you restin at my feet Why God, why God do I gotta suffer? Earth is no more, wont you burn this muhfucka? I dont think I could find a way to make it on this earth (Reversed)   I beat yo ass, keep talkin back I beat yo ass, who bought you that? You stole it, I beat yo ass if you say that game is broken I beat yo ass if you jump on my couch I beat yo ass if you walk in this house With tears in your eyes, runnin from Poo Poo and Prentice Go back outside, I beat yo ass, lil nigga That homework better be finished, I beat yo ass Your teachers better not be bitchin bout you in class That pizza better not be wasted, you eat it all That TV better not be loud if you got it on Them Jordans better not get dirty when I just bought em Better not hear bout you humpin on Keishas daughter Better not hear you got caught up I beat yo ass, you better not run to your father I beat yo ass, you know my patience runnin thin I got beaucoup payments to make County buildings on my ass Tryna take my food stamps away I beat yo ass if you tell them social workers he live here I beat yo ass if I beat yo ass twice and you still here Seven years old, think you run this house by yourself? Nigga, you gon fear me if you dont fear no one else   If I could smoke fear away, Id roll that mothafucka up And then Id take two puffs Im high now, Im high now Im high now, Im high now Lifes a bitch, pull them panties to the side now I dont think I could find a way to make it on this earth   Ill prolly die anonymous Ill prolly die with promises Ill prolly die walkin back home from the candy house Ill prolly die because these colors are standin out Ill prolly die because I aint know Demarcus was snitchin Ill prolly die at these house parties, fuckin with bitches Ill prolly die from witnesses leavin me falsed accused Ill prolly die from thinkin that me and your hood was cool Or maybe die from pressin the line, actin too extra Or maybe die because these smokers Are more than desperate Ill prolly die from one of these bats and blue badges Body slammed on black and white paint, my bones snappin Or maybe die from panic or die from bein too lax Or die from waitin on it, die cause Im movin too fast Ill prolly die tryna buy weed at the apartments Ill prolly die tryna diffuse two homies arguin Ill prolly die cause thats what you do when youre 17 All worries in a hurry, I wish I controlled things   If I could smoke fear away, Id roll that mothafucka up And then Id take two puffs Ive been hungry all my life Im high now, Im high now Im high now, Im high now Lifes a bitch, pull them panties to the side now Now…   When I was 27, I grew accustomed to more fear Accumulated 10 times over throughout the years My newfound life made all of me magnified How many accolades do I need to block denial? The shock value of my success put bolts in me All this money, is God playin a joke on me? Is it for the moment, and will he see me as Job? Take it from me and leave me worse than I was before? At 27, my biggest fear was losin it all Scared to spend money, had me sleepin from hall to hall Scared to go back to Section 8 with my mama stressin 30 shows a month and I still wont buy me no Lexus What is an advisor? Somebody thats holdin my checks Just to fuck me over and put my finances in debt? I read a case about Rihannas accountant and wondered How did the bad girl feel when she looked at them numbers? The type of shitll make me flip out And just kill somethin, drill somethin Get ill and fill ratchets with a lil somethin I practiced runnin from fear, guess I had some good luck At 27 years old, my biggest fear was bein judged How they look at me reflect on myself, my family, my city What they say bout me reveal If my reputation would miss me What they see from me Would trickle down generations in time What they hear from me Would make em highlight my simplest lines   Im talkin fear, fear of losin creativity Im talkin fear, fear of missin out on you and me Im talkin fear, fear of losin loyalty from pride Cause my DNA wont let me involve in the light of God Im talkin fear, fear that my humbleness is gone Im talkin fear, fear that love aint livin here no more Im talkin fear, fear that its wickedness or weakness Fear, whatever it is, both is distinctive Fear, what happens on Earth stays on Earth And I cant take these feelings with me So hopefully they disperse Within fourteen tracks, carried out over wax Searchin for resolutions until somebody get back Fear, what happens on Earth stays on Earth And I cant take these feelings with me So hopefully they disperse Within fourteen tracks, carried out over wax Wonderin if Im livin through fear or livin through rap   Damn Goddamn you Goddamn me Goddamn us Goddamn we Goddamn us all   Verse two says you only have I known of all the families of the Earth, therefore I will punish you for all your iniquities. So until we come back to these commandments, until you come back to these commandments, were gonna feel this way, were gonna be under this curse. Because he said hes gonna punish us, the so-called Blacks, Hispanics, and Native American Indians, are the true children of Israel. We are the Israelites according to the Bible. The children of Israel, hes gonna punish us for our iniquities, for our disobedience, because we chose to follow other gods that arent his son, so the Lord, thy God, chasten thee. So, just like you chasten your own son, hes gonna chastise you because he loves you. So thats why we get chastised, thats why were in the position were in. Until we come back to these laws, statutes and commandments, and do what the Lord said, these curses are gonna be upon us. Were gonna be at a lower state in this life that we live here in today, in the United States of America. I love you, son, and I pray for you. God bless you, shalom."
god," This what God feel like, huh, yeah Laughin to the bank like, ""A-ha!"", huh, yeah Flex on swole like, ""A-ha!"", huh, yeah You feel some type of way, then a-ha! Huh, yeah (a-ha-ha, a-ha-ha)   Ever since a young man All I wanted to be was a gunman Shootin up the charts, better run, man Yall gotta see that I won, man Slick as El DeBarge with the finger waves, work it, JT Handle bars like a fade, watch me work it, JT Im at large, runnin plays like a circuit, JT Im sellin verses, Jay Z, watch me work it, JT Look, look… hol up! Dont judge me, my mama caught me with a strap Dont judge me, I was young, fuckin all the rats Dont judge me, aimin at your head for a stack Dont judge me! Dont judge me! Now my home got a Valley peak Dont judge me, if I press your line you a freak Dont judge me, wont you tell a friend yall gon see—   This what God feel like, huh, yeah Laughin to the bank like, ""A-ha!"", huh, yeah Flex on swole like, ""A-ha!"", huh, yeah You feel some type of way, then a-ha! Huh, yeah (a-ha-ha, a-ha-ha)   Fuck is you talkin to? Aye, do you know who you talkin to? Slide on you like fallen drapes God toss full of carnivals I kill em with kindness Or I kill em with diamonds Or I put up like fifteen hundred Get yo ass killed by the finest Everything in life is a gamble Nothin in life I cant handle Seen it all, done it all, felt pain more For the cause, I done put blood on sword Everything I do is to embrace yall Everything I write is a damn eight ball Everything I touch is a damn gold mine Everything I say is from an angel   I dont rush shit, fuck shit Always your shit, my shit Cannonballs to ignite shit Morning to the night shift Im on, I aint sorry for it Ask for a piece of mine, you charged me for it I wanna see sometimes if you ignore it Im in the streets sometimes and cant afford it I got a bad habit Levitate, duckin haters Oh my! My heart is rich, my heart is famous   This what God feel like Huh, yeah (this what God feel like) Laughin to the bank like, ""A-ha!"" (This what God feel like) Huh, yeah (this what God feel like) Flex on swole like, ""A-ha!"" (This what God feel like) Huh, yeah (this what God feel like) You feel some type of way, then a-ha! (This what God feel like) Huh, yeah (this what God feel like) This what God feel like"
duckworth," It was always me vs the world Until I found its me vs me Why, why, why, why? Why, why, why, why? Just remember, what happens on Earth stays on Earth! We gon put it in reverse   Darling, I told you many times And I am telling you once again Just to remind you, sweetheart That my—   Oh Lamar, Hail Mary and marijuana, times is hard Pray with the hooligans, shadows all in the dark Fellowship with demons and relatives, Im a star Life is one funny mothafucka A true comedian, you gotta love him, you gotta trust him I might be buggin, infomercials and no sleep Introverted by my thoughts Children, listen, it gets deep See, once upon a time inside the Nickerson Garden projects The object was to process and digest povertys dialect Adaptation inevitable: gun violence, crack spot Federal policies raid buildings and drug professionals Anthony was the oldest of seven Well-respected, calm and collected Laughin and jokin made life easier Hard times, Momma on crack A four-year-old tellin his nanny he needed her His family history: pimpin and bangin He was meant to be dangerous Clocked him a grip and start slangin Fifteen, scrapin up his jeans with quarter pieces Even got some head from a smoker last weekend Dodged a policeman, workin for his big homie Small-time hustler, graduated to a brick on him 10,000 dollars out of a project housing, thats on the daily Seen his first mil twenty years old, had a couple of babies Had a couple of shooters Caught a murder case, fingerprints on the gun they assumin But witnesses couldnt prove it That was back when he turned his back And they killed his cousin He beat the case and went back to hustlin Bird-shufflin, Anthony rang The first in the projects with the two-tone Mustang That 5.0 thing, they say 5-0 came Circlin parking lots and parking spots And hoppin out while harrassin the corner blocks Crooked cops told Anthony he should kick it He brushed them off And walked back to the Kentucky Fried Chicken See, at this chicken spot There was a light-skinned nigga that talked a lot With a curly top and a gap in his teeth He worked the window, his name was Ducky He came from the streets, the Robert Taylor Homes Southside Projects, Chiraq, the Terror Dome Drove to California with a woman on him and 500 dollars They had a son, hopin that hed see college Hustlin on the side with a nine-to-five to freak it Cadillac Seville, hed ride his son around on weekends Three-piece special with his name on the shirt pocket Cross the street from the projects Anthony planned to rob it Stuck up the place before, back in 84 Thats when affiliation was really eight gears of war So many relatives tellin us, sellin us devilish works Killin us, crime, intelligent, felonious Prevalent proposition with 9s Ducky was well-aware They robbed the manager and shot a customer last year He figured hed get on these niggas good sides Free chicken every time Anthony posted in line Two extra biscuits, Anthony liked him And then let him slide; they didnt kill him In fact, it look like theyre the last to survive Pay attention, that one decision changed both of they lives One curse at a time Reverse the manifest and good karma, and Ill tell you why You take two strangers, and put em in random predicaments; give em a soul So they can make their own choices and live with it Twenty years later, them same strangers you make em meet again Inside recording studios where they reapin their benefits Then you start remindin them about that chicken incident Whoever thought the greatest rapper would be from coincidence? Because if Anthony killed Ducky Top Dawg could be servin life While I grew up without a father and die in a gunfight  {Gunshot}   {Reversed Audio} So, I was takin a walk the other day…"
